{"IP": {"IPType": "ipv4", "publicIPs": 7}, "application": "aplicatie", "budget": {"type": "USDollars", "value": "300"}, "components": [{"Compute": {"CPU": "1", "GPU": true, "Memory": "1"}, "Network": {"dataIn": "1", "dataOut": "1", "networkConnections": "1"}, "Storage": {"StorageType": "HDD"}, "id": 1, "keywords": ["Big Data Application", "Stream Processing"], "name": "qwe", "operatingSystem": "Linux"}, {"Compute": {"CPU": "2", "GPU": false, "Memory": "4"}, "Network": {"dataIn": "2", "dataOut": "2", "networkConnections": "2"}, "Storage": {"StorageType": "SSD"}, "id": 2, "keywords": ["Queue", "Big Data Application"], "name": "asd", "operatingSystem": "Windows"}], "restrictions": [{"alphaCompId": 1, "compIdList": [2], "type": "Conflicts"}, {"alphaCompId": 1, "betaCompId": 2, "type": "OneToOneDependency"}, {"alphaCompId": 1, "betaCompId": 2, "sign": "<=", "type": "ManyToManyDependency"}, {"alphaCompId": 1, "betaCompId": 2, "number": 2, "type": "OneToManyDependency"}, {"alphaCompId": 1, "bound": 2, "type": "UpperBound"}, {"alphaCompId": 1, "lowerBound": 2, "type": "RangeBound", "upperBound": 3}, {"compIdList": [2], "type": "FullDeployment"}]}